{
  "Name": "Default",

  "Description": "Очистка образа: убирает рекламные и редко нужные приложения, телеметрию и ИИ-функции, отключает драйверы и автообновление приложений Store через Windows Update. Не трогает Store, winget, Терминал, Фотографии, Калькулятор и Блокнот.",

  "Appx": {
    "Remove": [
      "Clipchamp.Clipchamp",
      "Microsoft.549981C3F5F10",
      "Microsoft.BingNews",
      "Microsoft.BingSearch",
      "Microsoft.BingWeather",
      "Microsoft.Copilot",
      "Microsoft.GetHelp",
      "Microsoft.Getstarted",
      "Microsoft.MicrosoftOfficeHub",
      "Microsoft.MicrosoftSolitaireCollection",
      "Microsoft.MicrosoftStickyNotes",
      "Microsoft.OutlookForWindows",
      "Microsoft.People",
      "Microsoft.PowerAutomateDesktop",
      "Microsoft.Todos",
      "Microsoft.WindowsAlarms",
      "Microsoft.WindowsFeedbackHub",
      "Microsoft.WindowsMaps",
      "Microsoft.WindowsSoundRecorder",
      "Microsoft.YourPhone",
      "Microsoft.ZuneVideo",
      "MicrosoftCorporationII.MicrosoftFamily",
      "MicrosoftCorporationII.QuickAssist",
      "MicrosoftTeams",
      "MSTeams"
    ]
  },

  "Capabilities": {
    "Remove": [
      "App.StepsRecorder*",
      "App.Support.QuickAssist*",
      "Browser.InternetExplorer*",
      "MathRecognizer*",
      "Media.WindowsMediaPlayer*",
      "Microsoft.Windows.PowerShell.ISE*",
      "Microsoft.Windows.WordPad*"
    ]
  },

  "Features": {
    "RemovePayload": false,
    "Disable": [
      "Recall",
      "WorkFolders-Client",
      "Printing-XPSServices-Features",
      "MicrosoftWindowsPowerShellV2Root",
      "MicrosoftWindowsPowerShellV2"
    ]
  },

  "Packages": {
    "Remove": []
  },

  "Registry": [
    { "Hive": "SOFTWARE", "Path": "Policies\\Microsoft\\Windows\\DataCollection", "Name": "AllowTelemetry", "Type": "REG_DWORD", "Value": 0, "Description": "Минимальный уровень телеметрии" },
    { "Hive": "SOFTWARE", "Path": "Policies\\Microsoft\\Windows\\CloudContent", "Name": "DisableWindowsConsumerFeatures", "Type": "REG_DWORD", "Value": 1, "Description": "Не устанавливать рекламные приложения автоматически" },
    { "Hive": "SOFTWARE", "Path": "Policies\\Microsoft\\Windows\\CloudContent", "Name": "DisableCloudOptimizedContent", "Type": "REG_DWORD", "Value": 1, "Description": "Отключить облачный контент в «Пуске»" },
    { "Hive": "SOFTWARE", "Path": "Policies\\Microsoft\\Windows\\WindowsCopilot", "Name": "TurnOffWindowsCopilot", "Type": "REG_DWORD", "Value": 1, "Description": "Отключить Copilot (для компьютера)" },
    { "Hive": "SOFTWARE", "Path": "Policies\\Microsoft\\Windows\\WindowsAI", "Name": "DisableAIDataAnalysis", "Type": "REG_DWORD", "Value": 1, "Description": "Отключить снимки Recall" },
    { "Hive": "SOFTWARE", "Path": "Policies\\Microsoft\\Windows\\Windows Search", "Name": "ConnectedSearchUseWeb", "Type": "REG_DWORD", "Value": 0, "Description": "Не искать в интернете из поиска Windows" },
    { "Hive": "SOFTWARE", "Path": "Microsoft\\Windows\\CurrentVersion\\Policies\\DataCollection", "Name": "AllowTelemetry", "Type": "REG_DWORD", "Value": 0, "Description": "Минимальный уровень телеметрии (системная ветка)" },
    { "Hive": "SOFTWARE", "Path": "Microsoft\\Windows\\CurrentVersion\\Policies\\DataCollection", "Name": "MaxTelemetryAllowed", "Type": "REG_DWORD", "Value": 0, "Description": "Ограничить максимальный уровень телеметрии" },
    { "Hive": "SOFTWARE", "Path": "Policies\\Microsoft\\Windows\\DataCollection", "Name": "AllowDeviceNameInTelemetry", "Type": "REG_DWORD", "Value": 0, "Description": "Не отправлять имя устройства в телеметрии" },
    { "Hive": "SOFTWARE", "Path": "Policies\\Microsoft\\Windows\\DataCollection", "Name": "DisableOneSettingsDownloads", "Type": "REG_DWORD", "Value": 1, "Description": "Не загружать конфигурацию OneSettings" },
    { "Hive": "SOFTWARE", "Path": "Policies\\Microsoft\\Windows\\DataCollection", "Name": "LimitDiagnosticLogCollection", "Type": "REG_DWORD", "Value": 1, "Description": "Ограничить сбор диагностических журналов" },
    { "Hive": "SOFTWARE", "Path": "Policies\\Microsoft\\Windows\\DataCollection", "Name": "LimitDumpCollection", "Type": "REG_DWORD", "Value": 1, "Description": "Ограничить сбор дампов памяти" },
    { "Hive": "SOFTWARE", "Path": "Policies\\Microsoft\\Windows\\AppCompat", "Name": "DisableInventory", "Type": "REG_DWORD", "Value": 1, "Description": "Отключить сборщик инвентаризации приложений" },
    { "Hive": "SOFTWARE", "Path": "Policies\\Microsoft\\Windows\\AppCompat", "Name": "DisableUAR", "Type": "REG_DWORD", "Value": 1, "Description": "Отключить средство записи действий (UAR)" },
    { "Hive": "SOFTWARE", "Path": "Policies\\Microsoft\\Windows\\AppCompat", "Name": "AITEnable", "Type": "REG_DWORD", "Value": 0, "Description": "Отключить телеметрию совместимости приложений" },
    { "Hive": "SOFTWARE", "Path": "Policies\\Microsoft\\Windows\\Windows Error Reporting", "Name": "Disabled", "Type": "REG_DWORD", "Value": 1, "Description": "Отключить отправку отчётов об ошибках" },
    { "Hive": "SOFTWARE", "Path": "Policies\\Microsoft\\SQMClient\\Windows", "Name": "CEIPEnable", "Type": "REG_DWORD", "Value": 0, "Description": "Отключить программу улучшения качества ПО" },
    { "Hive": "SOFTWARE", "Path": "Policies\\Microsoft\\Windows\\WindowsAI", "Name": "AllowRecallEnablement", "Type": "REG_DWORD", "Value": 0, "Description": "Сделать Recall недоступным" },
    { "Hive": "SOFTWARE", "Path": "Policies\\Microsoft\\Windows\\WindowsAI", "Name": "DisableClickToDo", "Type": "REG_DWORD", "Value": 1, "Description": "Отключить Click to Do (для компьютера)" },
    { "Hive": "SOFTWARE", "Path": "Policies\\Microsoft\\Windows\\WindowsAI", "Name": "DisableSettingsAgent", "Type": "REG_DWORD", "Value": 1, "Description": "Отключить ИИ-агента в Параметрах" },
    { "Hive": "SOFTWARE", "Path": "Microsoft\\Windows\\CurrentVersion\\Policies\\Paint", "Name": "DisableCocreator", "Type": "REG_DWORD", "Value": 1, "Description": "Отключить Cocreator в Paint" },
    { "Hive": "SOFTWARE", "Path": "Microsoft\\Windows\\CurrentVersion\\Policies\\Paint", "Name": "DisableGenerativeFill", "Type": "REG_DWORD", "Value": 1, "Description": "Отключить генеративную заливку в Paint" },
    { "Hive": "SOFTWARE", "Path": "Microsoft\\Windows\\CurrentVersion\\Policies\\Paint", "Name": "DisableImageCreator", "Type": "REG_DWORD", "Value": 1, "Description": "Отключить Image Creator в Paint" },
    { "Hive": "SOFTWARE", "Path": "Policies\\WindowsNotepad", "Name": "DisableAIFeatures", "Type": "REG_DWORD", "Value": 1, "Description": "Отключить ИИ-функции Блокнота" },
    { "Hive": "SOFTWARE", "Path": "Policies\\Microsoft\\Windows\\AppPrivacy", "Name": "LetAppsAccessGenerativeAI", "Type": "REG_DWORD", "Value": 2, "Description": "Запретить приложениям доступ к генеративному ИИ" },
    { "Hive": "SOFTWARE", "Path": "Policies\\Microsoft\\Windows\\AppPrivacy", "Name": "LetAppsAccessSystemAIModels", "Type": "REG_DWORD", "Value": 2, "Description": "Запретить приложениям доступ к системным ИИ-моделям" },
    { "Hive": "SOFTWARE", "Path": "Policies\\Microsoft\\Edge", "Name": "HubsSidebarEnabled", "Type": "REG_DWORD", "Value": 0, "Description": "Отключить боковую панель Copilot в Edge" },
    { "Hive": "SOFTWARE", "Path": "Policies\\Microsoft\\WindowsStore", "Name": "AutoDownload", "Type": "REG_DWORD", "Value": 2, "Description": "Отключить автоматическую загрузку и обновление приложений Store" },
    { "Hive": "SOFTWARE", "Path": "Policies\\Microsoft\\Windows\\DriverSearching", "Name": "SearchOrderConfig", "Type": "REG_DWORD", "Value": 0, "Description": "Не искать драйверы в Windows Update" },
    { "Hive": "SOFTWARE", "Path": "Policies\\Microsoft\\Windows\\DriverSearching", "Name": "DontSearchWindowsUpdate", "Type": "REG_DWORD", "Value": 1, "Description": "Не искать драйверы в Windows Update" },
    { "Hive": "SOFTWARE", "Path": "Policies\\Microsoft\\Windows\\DriverSearching", "Name": "DriverUpdateWizardWuSearchEnabled", "Type": "REG_DWORD", "Value": 0, "Description": "Не искать драйверы в Windows Update из мастера обновления" },
    { "Hive": "SOFTWARE", "Path": "Policies\\Microsoft\\Windows\\DriverSearching", "Name": "DontPromptForWindowsUpdate", "Type": "REG_DWORD", "Value": 1, "Description": "Не предлагать поиск драйверов в Windows Update" },
    { "Hive": "SOFTWARE", "Path": "Policies\\Microsoft\\Windows\\WindowsUpdate", "Name": "ExcludeWUDriversInQualityUpdate", "Type": "REG_DWORD", "Value": 1, "Description": "Не устанавливать драйверы вместе с обновлениями Windows" },
    { "Hive": "SOFTWARE", "Path": "Policies\\Microsoft\\Windows\\Device Metadata", "Name": "PreventDeviceMetadataFromNetwork", "Type": "REG_DWORD", "Value": 1, "Description": "Не загружать метаданные устройств из интернета" },
    { "Hive": "SOFTWARE", "Path": "Microsoft\\WindowsUpdate\\Orchestrator\\UScheduler_Oobe\\DevHomeUpdate", "Action": "DeleteKey", "Description": "Не доустанавливать Dev Home после установки" },
    { "Hive": "SOFTWARE", "Path": "Microsoft\\WindowsUpdate\\Orchestrator\\UScheduler_Oobe\\OutlookUpdate", "Action": "DeleteKey", "Description": "Не доустанавливать новый Outlook после установки" },

    { "Hive": "SYSTEM", "Path": "ControlSet001\\Services\\DiagTrack", "Name": "Start", "Type": "REG_DWORD", "Value": 4, "Description": "Отключить службу телеметрии DiagTrack" },

    { "Hive": "DefaultUser", "Path": "Software\\Microsoft\\Windows\\CurrentVersion\\ContentDeliveryManager", "Name": "ContentDeliveryAllowed", "Type": "REG_DWORD", "Value": 0, "Description": "Отключить доставку рекламного контента" },
    { "Hive": "DefaultUser", "Path": "Software\\Microsoft\\Windows\\CurrentVersion\\ContentDeliveryManager", "Name": "SilentInstalledAppsEnabled", "Type": "REG_DWORD", "Value": 0, "Description": "Не устанавливать приложения без спроса" },